URL,Title,Niche,Quality Score,Email,Contact Page,Instagram,Outreach Hook,Offer,Status,Timestamp
"https://example-fashion-store.com","Trendy Boutique","Fashion",5.5,"contact@example-fashion.com","https://example-fashion-store.com/pages/contact","https://instagram.com/trendyboutique","Your product pages list features like 'cotton blend' without showing how customers will look or feel - focusing on outcomes could boost conversions","Free rewrite of your best-selling item page showing benefit-driven copy","Not Contacted","2024-02-15T10:30:00.000Z"
"https://glow-beauty.com","Glow Skincare","Beauty",4.2,"info@glow-beauty.com","https://glow-beauty.com/contact","https://instagram.com/glowbeauty","Your serum descriptions focus on ingredients rather than visible results - customers want to know what their skin will look like, not just what's in it","Free sample description emphasizing skin transformation and visible benefits","Not Contacted","2024-02-15T10:31:00.000Z"
"https://vitaboost-supplements.com","VitaBoost Nutrition","Supplements",6.8,"support@vitaboost.com","","https://instagram.com/vitaboost","Your supplement copy does well with health claims but could strengthen the emotional appeal - connecting benefits to how customers will feel daily","Free rewrite showing how to blend science with lifestyle benefits","Not Contacted","2024-02-15T10:32:00.000Z"
"https://chic-apparel.myshopify.com","Chic Apparel Co","Fashion",3.9,"","https://chic-apparel.myshopify.com/pages/contact-us","","Your product titles are descriptive but copy lacks personality and brand voice - adding story and emotion could differentiate from competitors","Free brand voice guide with sample product rewrites","Not Contacted","2024-02-15T10:33:00.000Z"
"https://pure-organics.com","Pure Organics Beauty","Beauty",7.2,"hello@pure-organics.com","https://pure-organics.com/pages/contact","https://instagram.com/pureorganicsbeauty","Your copy effectively highlights natural ingredients and you have good benefit statements - minor tweaks to urgency and social proof placement could optimize conversion","Free audit of your highest-traffic pages with quick-win suggestions","Not Contacted","2024-02-15T10:34:00.000Z"
